"1","Avatar 1","English, Spanish","7.8","18 December 2009","2h 42min","When his brother is killed in a robbery, paraplegic Marine Jake Sully decides to take his place in a mission on the distant world of Pandora. There he learns of greedy corporate figurehead Parker Selfridge's intentions of driving off the native humanoid ""Na'vi"" in order to mine for the precious material scattered throughout their rich woodland. In exchange for the spinal surgery that will fix his legs, Jake gathers intel for the cooperating military unit spearheaded by gung-ho Colonel Quaritch, while simultaneously attempting to infiltrate the Na'vi people with the use of an ""avatar"" identity. While Jake begins to bond with the native tribe and quickly falls in love with the beautiful alien Neytiri, the restless Colonel moves forward with his ruthless extermination tactics, forcing the soldier to take a stand - and fight back in an epic battle for the fate of Pandora."
"2","Aquaman ","English ","7.4","21 December 2018","2h 23min","Arthur Curry, half human half from Atlantis, goes on a trip of a lifetime. Not only does this adventure compel him to come to terms with his real identity, but it also forces him to discover whether he is entirely worthy of fulfilling his own destiny: becoming a king."
"3","Black Panther","Swahili, Nama, English, Xhosa, Korean","7.4","16 February 2018","2h 14min","After the events of Captain America: Civil War, Prince T'Challa returns home to the reclusive, technologically advanced African nation of Wakanda to serve as his country's new king. However, T'Challa soon finds that he is challenged for the throne from factions within his own country. When two foes conspire to destroy Wakanda, the hero known as Black Panther must team up with C.I.A. agent Everett K. Ross and members of the Dora Milaje, Wakandan special forces, to prevent Wakanda from being dragged into a world war."
"4","Doctor Strange","English","7.5","4 November 2016","1h 55min","Marvel's ""Doctor Strange"" follows the story of the talented neurosurgeon Doctor Stephen Strange who, after a tragic car accident, must put ego aside and learn the secrets of a hidden world of mysticism and alternate dimensions. Based in New York City's Greenwich Village, Doctor Strange must act as an intermediary between the real world and what lies beyond, utilising a vast array of metaphysical abilities and artifacts to protect the Marvel Cinematic Universe."
"5","Guardians of the Galaxy","English ","8.1","1 August 2014","2h 1min","After stealing a mysterious orb in the far reaches of outer space, Peter Quill from Earth is now the main target of a manhunt led by the villain known as Ronan the Accuser. To help fight Ronan and his team and save the galaxy from his power, Quill creates a team of space heroes known as the ""Guardians of the Galaxy"" to save the galaxy."
"6","Finding Dory","English, Indonesian","7.3","17 June 2016","1h 37min","Dory is a wide-eyed, blue tang fish who suffers from memory loss every 10 seconds or so. The one thing she can remember is that she somehow became separated from her parents as a child. With help from her friends Nemo and Marlin, Dory embarks on an epic adventure to find them. Her journey brings her to the Marine Life Institute, a conservatory that houses diverse ocean species."
"7","Moana","English ","7.6","23 November 2016"," 1h 47min","Moana Waialiki is a sea voyaging enthusiast and the only daughter of a chief in a long line of navigators. When her island's fishermen can't catch any fish and the crops fail, she learns that the demigod Maui caused the blight by stealing the heart of the goddess, Te Fiti. The only way to heal the island is to persuade Maui to return Te Fiti's heart, so Moana sets off on an epic journey across the Pacific. The film is based on stories from Polynesian mythology. "
"8","Deadpool 1","English, Cantonese, Spanish, Russian","8.0","18 May 2018","1h 59min","This is the origin story of former Special Forces operative turned mercenary Wade Wilson, who after being subjected to a rogue experiment that leaves him with accelerated healing powers, adopts the alter ego Deadpool. Armed with his new abilities and a dark, twisted sense of humor, Deadpool hunts down the man who nearly destroyed his life. "
"9","Captain America: The Winter Soldier","English, French","7.8","4 April 2014","2h 16min","For Steve Rogers, awakening after decades of suspended animation involves more than catching up on pop culture; it also means that this old school idealist must face a world of subtler threats and difficult moral complexities. That becomes clear when Director Nick Fury is killed by the mysterious assassin, the Winter Soldier, but not before warning Rogers that SHIELD has been subverted by its enemies. When Rogers acts on Fury's warning to trust no one there, he is branded as a traitor by the organization. Now a fugitive, Captain America must get to the bottom of this deadly mystery with the help of the Black Widow and his new friend, The Falcon. However, the battle will be costly for the Sentinel of Liberty, with Rogers finding enemies where he least expects them while learning that the Winter Soldier looks disturbingly familiar."
"10","Thor","English ","7.0","6 May 2011","1h 55min","The warrior Thor (Chris Hemsworth) is cast out of the fantastic realm of Asgard by his father Odin (Sir Anthony Hopkins) for his arrogance and sent to Earth to live amongst humans. Falling in love with scientist Jane Foster (Natalie Portman) teaches Thor much-needed lessons, and his new-found strength comes into play as a villain from his homeland sends dark forces toward Earth. "
"11","Glass","English, Spanish","7.0","18 January 2019","2h 9min","After pursuing Kevin Wendell Crumb and the multiple identities that reside within. David Dunn finds himself locked in a mental hospital alongside his archenemy, Elijah Price and must contend with a psychiatrist who is out to prove the trio do not actually possess superhuman abilities"
"12","Bumblebee","English","7.1","21 December 2018","1h 54min","On the run in the year 1987, Bumblebee finds refuge in a junkyard in a small Californian beach town. Charlie (Hailee Steinfeld), on the cusp of turning 18 and trying to find her place in the world, discovers Bumblebee, battle-scarred and broken. When Charlie revives him, she quickly learns this is no ordinary, yellow VW bug."
"13","Transformers: Dark of the Moon","English","6.3","29 June 2011","2h 34min","Autobots Bumblebee, Ratchet, Ironhide, Mirage (aka Dino), Wheeljack (aka Que) and Sideswipe led by Optimus Prime, are back in action taking on the evil Decepticons, who are eager to avenge their recent defeat. The Autobots and Decepticons become involved in a perilous space race between the United States and Russia to reach a hidden Cybertronian spacecraft on the moon and learn its secrets, and once again Sam Witwicky has to go to the aid of his robot friends. The new villain Shockwave is on the scene while the Autobots and Decepticons continue to battle it out on Earth."
"14","Venom","English","6.8","5 October 2018","1h 52min","After a faulty interview with the Life Foundation ruins his career, former reporter Eddie Brock's life is in pieces. Six months later, he comes across the Life Foundation again, and he comes into contact with an alien symbiote and becomes Venom, a parasitic antihero."
"15","Fast Five","English, Portuguese, Spanish, Italian, French","7.3","29 April 2011","2h 10min","Former cop Brian O'Conner partners with ex-con Dom Toretto on the opposite side of the law. Since Brian and Mia Toretto broke Dom out of custody, they've blown across many borders to elude authorities. Now backed into a corner in Rio de Janeiro, they must pull one last job in order to gain their freedom. As they assemble their elite team of top racers, the unlikely allies know their only shot of getting out for good means confronting the corrupt businessman who wants them dead. But he's not the only one on their tail. Hard-nosed federal agent Luke Hobbs never misses his target. When he is assigned to track down Dom and Brian, he and his strike team launch an all-out assault to capture them. But as his men tear through Brazil, Hobbs learns he can't separate the good guys from the bad. Now, he must rely on his instincts to corner his prey... before someone else runs them down first."
"16","Pirates of the Caribbean: On Stranger Tides"," English, Spanish","6.6","20 May 2011","2h 16min","Captain Jack Sparrow (Depp) crosses paths with a woman from his past (Cruz), and he's not sure if it's love -- or if she's a ruthless con artist who's using him to find the fabled Fountain of Youth. When she forces him aboard the Queen Anne's Revenge, the ship of the formidable pirate Blackbeard (McShane), Jack finds himself on an unexpected adventure in which he doesn't know who to fear more: Blackbeard or the woman from his past."
"17","Deadpool 2"," English, Cantonese, Spanish, Russian","7.8","18 May 2018","1h 59min","After losing Vanessa (Morena Baccarin), the love of his life, 4th-wall breaking mercenary Wade Wilson aka Deadpool (Ryan Reynolds) must assemble a team and protect a young, full-figured mutant Russell Collins aka Firefist (Julian Dennison) from Cable (Josh Brolin), a no-nonsense, dangerous cyborg from the future, and must also learn the most important lesson of all: to be part of a family again."
"18","Pirates of the Caribbean: At World's End","English","7.1","25 May 2007","2h 49min","After Elizabeth, Will, and Captain Barbossa rescue Captain Jack Sparrow from the the land of the dead, they must face their foes, Davy Jones and Lord Cutler Beckett. Beckett, now with control of Jones' heart, forms a dark alliance with him in order to rule the seas and wipe out the last of the Pirates. Now, Jack, Barbossa, Will, Elizabeth, Tia Dalma, and crew must call the Pirate Lords from the four corners of the globe, including the infamous Sao Feng, to gathering. The Pirate Lords want to release the goddess Calypso, Davy Jones's damned lover, from the trap they sent her to out of fear, in which the Pirate Lords must combine the 9 pieces that bound her by ritual to undo it and release her in hopes that she will help them fight. With this, all pirates will stand together and will make their final stand for freedom against Beckett, Jones, Norrington, the Flying Dutchman, and the entire East India Trading Company."
"19","Avengers: Age of Ultron"," English, Korean","7.4","1 May 2015","2h 21min","Tony Stark creates the Ultron Program to protect the world, but when the peacekeeping program becomes hostile, The Avengers go into action to try and defeat a virtually impossible enemy together. Earth's mightiest heroes must come together once again to protect the world from global extinction."
"20","Superman Returns","English, German, French","6.1","28 June 2006","2h 34min","Following a mysterious absence of several years, the Man of Steel comes back to Earth in the epic action-adventure Superman Returns, a soaring new chapter in the saga of one of the world's most beloved superheroes. While an old enemy plots to render him powerless once and for all, Superman faces the heartbreaking realization that the woman he loves, Lois Lane, has moved on with her life. Or has she? Superman's bittersweet return challenges him to bridge the distance between them while finding a place in a society that has learned to survive without him. In an attempt to protect the world he loves from cataclysmic destruction, Superman embarks on an epic journey of redemption that takes him from the depths of the ocean to the far reaches of outer space."
"21","John Carter","English","6.6","9 March 2012","2h 12min","John Carter, a Civil War veteran, who in 1868 was trying to live a normal life, is ""asked"" by the Army to join, but he refuses so he is locked up. He escapes, and is pursued. Eventually they run into some Indians, and there's a gunfight. Carter seeks refuge in a cave. While there, he encounters someone who is holding some kind of medallion. When Carter touches it, he finds himself in a place where he can leap incredible heights, among other things. He later encounters beings he has never seen before. He meets a woman who helps him to discover that he is on Mars, and he learns there's some kind of unrest going on."
"22","Tangled","English","7.8"," 24 November 2010","1h 40min","After receiving the healing powers from a magical flower, the baby Princess Rapunzel is kidnapped from the palace in the middle of the night by Mother Gothel. Mother Gothel knows that the flower's magical powers are now growing within the golden hair of Rapunzel, and to stay young, she must lock Rapunzel in her hidden tower. Rapunzel is now a teenager and her hair has grown to a length of 70-feet. The beautiful Rapunzel has been in the tower her entire life, and she is curious of the outside world. One day, the bandit Flynn Ryder scales the tower and is taken captive by Rapunzel. Rapunzel strikes a deal with the charming thief to act as her guide to travel to the place where the floating lights come from that she has seen every year on her birthday. Rapunzel is about to have the most exciting and magnificent journey of her life."
"23","Spider-Man 3","English, French","6.2"," 4 May 2007","2h 19min","Peter Parker has finally managed to piece together the once-broken parts of his life, maintaining a balance between his relationship with Mary-Jane and his responsibility as Spider-Man. But more challenges arise for our young hero. Peter's old friend Harry Obsourne has set out for revenge against Peter; taking up the mantle of his late father's persona as The New Goblin, and Peter must also capture Uncle Ben's real killer, Flint Marko, who has been transformed into his toughest foe yet, the Sandman. All hope seems lost when suddenly Peter's suit turns jet-black and greatly amplifies his powers. But it also begins to greatly amplify the much darker qualities of Peter's personality that he begins to lose himself to. Peter has to reach deep inside himself to free the compassionate hero he used to be if he is to ever conquer the darkness within and face not only his greatest enemies, but also...himself."
"24","The Lone Ranger","English, North American Indian","6.4","3 July 2013","2h 30min","In the 1930s, an elderly Tonto tells a young boy the tale of John Reid, the Lone Ranger. An idealistic lawyer, he rides with his brother and fellow Texas Rangers in pursuit of the notorious Butch Cavendish. Ambushed by the outlaw and left for dead, John Reid is rescued by the renegade Comanche, Tonto, at the insistence of a mysterious white horse and offers to help him to bring Cavendish to justice. Becoming a reluctant masked rider with a seemingly incomprehensible partner, Reid pursues the criminal against all obstacles. However, John and Tonto learn that Cavendish is only part of a far greater injustice and the pair must fight it in an adventure that would make them a legend."
"25","The Dark Knight Rises","English, Arabic","8.4"," 20 July 2012","2h 44min","Despite his tarnished reputation after the events of The Dark Knight, in which he took the rap for Dent's crimes, Batman feels compelled to intervene to assist the city and its police force which is struggling to cope with Bane's plans to destroy the city."
"26","Harry Potter and the Half-Blood Prince","English","7.6"," 15 July 2009","2h 33min","In Harry Potter's sixth year at Hogwarts School of Witchcraft, Harry finds a book marked mysteriously, ""This book is the property of the Half Blood Prince,"" which helps him excel at Potions class and teaches him a few dark and dangerous ones along the way. Meanwhile, Harry is taking private lessons with Dumbledore in order to find out about Voldemort's past so they can find out what might his only weakness."
"27","Batman v Superman: Dawn of Justice","English","6.5","25 March 2016","2h 31min","The general public is concerned over having Superman on their planet and letting the ""Dark Knight"" - Batman - pursue the streets of Gotham. While this is happening, a power-phobic Batman tries to attack Superman. Meanwhile, Superman tries to settle on a decision, and Lex Luthor, the criminal mastermind and millionaire, tries to use his own advantages to fight the ""Man of Steel""."
"28","The Hobbit: The Battle of the Five Armies","English","7.4","17 December 2014","2h 24min","After the Dragon leaves the Lonely Mountain, the people of Lake-town see a threat coming. Orcs, dwarves, elves and people prepare for war. Bilbo sees Thorin going mad and tries to help. Meanwhile, Gandalf is rescued from the Necromancer's prison and his rescuers realize who the Necromancer is."
"29","Captain America: Civil War","English, German, Xhosa, Russian, Romanian, Hindi","7.8","6 May 2016","2h 27min","With many people fearing the actions of super heroes, the government decides to push for the Hero Registration Act, a law that limits a hero's actions. This results in a division in The Avengers. Iron Man stands with this Act, claiming that their actions must be kept in check otherwise cities will continue to be destroyed, but Captain America feels that saving the world is daring enough and that they cannot rely on the government to protect the world. This escalates into an all-out war between Team Iron Man (Iron Man, Black Panther, Vision, Black Widow, War Machine, and Spider-Man) and Team Captain America (Captain America, Bucky Barnes, Falcon, Scarlet Witch, Hawkeye, and Ant Man) while a new villain emerges."
"30","X-Men: Days of Future Past","English, Vietnamese, French","8.0","23 May 2014","2h 12min","In the future, the mutants and the humans who help them are slaughtered by powerful robots named Sentinels. Professor Xavier, Wolverine, Magneto, Storm, Kitty Pryde, and her friends meet at a monastery in China and Xavier explains that the invincible Sentinels were created using the DNA of Mystique that was captured in 1973 when she tried to assassinate their creator Dr. Bolivar Trask. Xavier tells that their only chance is return to 1973 using Pryde's ability to join Charles Xavier and Erik Lehnsherr to convince Mystique to give up her intention. However, only Wolverine can withstand the damages of the time travel. Will he succeed in stopping Mystique and the Sentinel Program, and save the mutants and their human friends from annihilation?"
"31","Spectre","English, Spanish, Italian, German, French","6.8","6 November 2015","2h 28min","A cryptic message from the past sends James Bond on a rogue mission to Mexico City and eventually Rome, where he meets Lucia, the beautiful and forbidden widow of an infamous criminal. Bond infiltrates a secret meeting and uncovers the existence of the sinister organisation known as SPECTRE. Meanwhile back in London, Max Denbigh, the new head of the Centre of National Security, questions Bond's actions and challenges the relevance of MI6 led by M. Bond covertly enlists Moneypenny and Q to help him seek out Madeleine Swann, the daughter of his old nemesis Mr White, who may hold the clue to untangling the web of SPECTRE. As the daughter of the assassin, she understands Bond in a way most others cannot. As Bond ventures towards the heart of SPECTRE, he learns a chilling connection between himself and the enemy he seeks."
"32","Man of Steel","English","7.1","14 June 2013","2h 23min","A young boy learns that he has extraordinary powers and is not of this Earth. As a young man, he journeys to discover where he came from and what he was sent here to do. But the hero in him must emerge if he is to save the world from annihilation and become the symbol of hope for all mankind."
"33","King Kong","English","7.2","14 December 2005","3h 7min","Carl Denham needs to finish his movie and has the perfect location; Skull Island. But he still needs to find a leading lady. This 'soon-to-be-unfortunate' soul is Ann Darrow. No one knows what they will encounter on this island and why it is so mysterious, but once they reach it, they will soon find out. Living on this hidden island is a giant gorilla and this beast now has Ann is its grasps. Carl and Ann's new love, Jack Driscoll must travel through the jungle looking for Kong and Ann, whilst avoiding all sorts of creatures and beasts. But Carl has another plan in mind."
"34","Quantum of Solace ","English, Spanish, Italian, French, Swiss, German, German","6.6","14 November 2008","1h 46min","Is there solace in revenge? Bond and ""M"" sniff a shadowy international network of power and corruption reaping billions. As Bond pursues the agents of an assassination attempt on ""M,"" all roads lead to Dominic Greene, a world-renowned developer of green technology. Greene, a nasty piece of work, is intent on securing a barren area of Bolivia in exchange for assisting a strongman stage a coup there. The CIA looks the other way, and only Bond, with help from a retired spy and from a mysterious beauty, stands in Greene's way. ""M"" wonders if she can trust Bond, or if vengeance possesses him. Beyond that, can anyone drawn to Bond live to tell the tale?"
"35","Skyfall ","English, Turkish, Shanghainese, Portuguese, Japanese","7.8","9 November 2012","2h 23min","When Bond's latest assignment goes gravely wrong and agents around the world are exposed, MI6 is attacked forcing M to relocate the agency. These events cause her authority and position to be challenged by Gareth Mallory (Ralph Fiennes), the new Chairman of the Intelligence and Security Committee. With MI6 now compromised from both inside and out, M is left with one ally she can trust: Bond. 007 takes to the shadows - aided only by field agent, Eve (Naomie Harris) - following a trail to the mysterious Silva (Javier Bardem), whose lethal and hidden motives have yet to reveal themselves."
"36","The Intent","English","4.2","29 July 2016","1h 44min","Gunz (Dylan Duffus) is thrust into a world of excitement when he joins the TIC crew. The crew, led by the ruthless Hoodz (Scorcher), goes from low level weed peddling to full on armed robberies within a fortnight. Their new found infamy affords them a life of guns, drugs, and girls but they also catch the attention of the police and a rival gang. To make matters worse they have been infiltrated by an undercover police officer. Does he have ""THE INTENT"" to remain a criminal or abide by his oath to the force?"
"37","Jurassic World: Fallen Kingdom","English, Russian","6.2","22 June 2018","2h 8min","Three years after the Jurassic World theme park was closed down, Owen and Claire return to Isla Nublar to save the dinosaurs when they learn that a once dormant volcano on the island is active and is threatening to extinguish all life there. Along the way, Owen sets out to find Blue, his lead raptor, and discovers a conspiracy that could disrupt the natural order of the entire planet. Life has found a way, again."
"38","T2 Trainspotting","English, Bulgarian, Scots","7.2","31 March 2017","1h 57min","First there was an opportunity......then there was a betrayal. Twenty years have gone by. Much has changed but just as much remains the same. Mark Renton (Ewan McGregor) returns to the only place he can ever call home. They are waiting for him: Spud (Ewen Bremner), Sick Boy (Jonny Lee Miller), and Begbie (Robert Carlyle). Other old friends are waiting too: sorrow, loss, joy, vengeance, hatred, friendship, love, longing, fear, regret, diamorphine, self-destruction and mortal danger, they are all lined up to welcome him, ready to join the dance."
"39","You ","English","7.9","9 September 2018","45min","Based on Caroline Kepnes' best-selling novel of the same name, YOU is a 21st century love story that asks, ""What would you do for love?"" When a brilliant bookstore manager crosses paths with an aspiring writer, his answer becomes clear: anything. Using the internet and social media as his tools to gather the most intimate of details and get close to her, a charming and awkward crush quickly becomes obsession as he quietly and strategically removes every obstacle - and person - in his way."
"40","Robin Hood","English","5.3","21 November 2018","1h 56min","A war-hardened crusader Robin of Loxley (Taron Egerton) and his Moorish commander (Jamie Foxx) mount an audacious revolt against the corrupt English crown."
"41","About time","English","7.8","8 November 2013","2h 3min ","At the age of 21, Tim Lake (Domhnall Gleeson) discovers he can travel in time... The night after another unsatisfactory New Year party, Tim's father (Bill Nighy) tells his son that the men in his family have always had the ability to travel through time. Tim can't change history, but he can change what happens and has happened in his own life-so he decides to make his world a better place...by getting a girlfriend. Sadly, that turns out not to be as easy as you might think. Moving from the Cornwall coast to London to train as a lawyer, Tim finally meets the beautiful but insecure Mary (Rachel McAdams). They fall in love, then an unfortunate time-travel incident means he's never met her at all. So they meet for the first time again-and again-but finally, after a lot of cunning time-traveling, he wins her heart. Tim then uses his power to create the perfect romantic proposal, to save his wedding from the worst best-man speeches, to save his best friend from professional disaster and to..."
