"42","500 Days of Summer","English, French, Swedish","7.7","7 August 2009","1h 35min","After it looks as if she's left his life for good this time, Tom Hansen reflects back on the just over one year that he knew Summer Finn. For Tom, it was love at first sight when she walked into the greeting card company where he worked, she the new administrative assistant. Soon, Tom knew that Summer was the woman with whom he wanted to spend the rest of his life. Although Summer did not believe in relationships or boyfriends - in her assertion, real life will always ultimately get in the way - Tom and Summer became more than just friends. Through the trials and tribulations of Tom and Summer's so-called relationship, Tom could always count on the advice of his two best friends, McKenzie and Paul. However, it is Tom's adolescent sister, Rachel, who is his voice of reason. After all is said and done, Tom is the one who ultimately has to make the choice to listen or not."
"43","Blue Valentine","English","7.4","28 January 2011","1h 52min","Dean Pereira and Cindy Heller Pereira are a young, working class married couple - Dean currently working as a painter, and Cindy working as a nurse in a medical clinic - with a young daughter named Frankie. Despite their relatively tender ages, they are both ravaged by the life they've eked out together and by the experiences they've had leading into their marriage. Dean, a high school drop out, comes from a broken home, where he never really had a mother figure. He never saw himself getting married or having a family despite falling in love at first sight with Cindy. He doesn't have any professional ambition beyond his current work - which he enjoys since he feels he can knock off a beer at 8 o'clock in the morning without it affecting his work - although Cindy believes he has so much more potential in life. Cindy also comes from a dysfunctional family, with her own mother and father not setting an example of a harmonious married or family life. One of her previous serious ..."
"44","Before We Go","English","6.8","21 July 2015","1h 35min","A woman misses the 1:30 train from New York to Boston and a street musician spends the night trying to help her make it back home before her husband does. Throughout the night they learn a lot about one another and eventually find a romance."
"45","Dude","English","5.1","20 April 2018","1h 37min","DUDE is a grounded comedy about dealing with first losses in life--leaving your best friends, the death of loved ones, and the passage of time--and that odd mixture of grief and nostalgia experienced by young people as they try to understand these losses. It is also about getting stoned with your friends in your car while listening to hip-hop."
"46","47 Ronin ","English, Japanese","6.3","25 December 2013","2h 8min","While hunting in the forest, Lord Asano of Ako and his samurai find a young half-breed and take him with them to live in the castle. Several years later, Lord Asano holds a tournament to welcome the Shogun to Ako. The night after the tournament, Lord Asano is bewitched into hurting Lord Kira of Nagato, and is punished into committing seppuku by the Shogun. Realizing that it was a Lord Kira's evil plot, the samurais and the half-breed sets out for revenge against the Shogun's order."
"47","Warcraft: The Beginning ","English","6.9","10 June 2016","2h 3min","When the world of the Orcs of Draenor is being destroyed by the evil fel magic that uses life-force, the powerful warlock Gul'dan creates a portal to the world of Azeroth and forms the Horde with members of the Orc clans. He also captures many prisoners to keep the portal open. The king of Azeroth, Llane Wrynn and his brother-in-law, Anduin Lothar are informed by the apprentice of magician Khadgar that he has found fel magic in dead bodies and the king decides to summon the Guardian of Tirisfal, Medivh, to protect his kingdom. Lothar and Khadgar head to Kharazhan to meet Medivh and an ominous shadow points a book out to Khadgar, who takes it and hides. Anduin, Khadgar and Medivh and a group of soldiers are attacked by Orcs and they capture the slave Garona, who is released by King Llane, and she shows them the location of the portal. Garona is contacted by the Orc chief of a clan Durotan that wants to meet King Llane to stop the fel magic. Meanwhile Khadgar learns that the gate was ..."
"48","Polar ","English, Russian","6.3","25 January 2019","1h 58min","The world's top assassin, Duncan Vizla, is settling into retirement when his former employer marks him as a liability to the firm. Against his will, he finds himself back in the game going head to head with an army of younger killers."
"49","Close","Arabic, Frenchc, English","5.6","18 January 2019","1h 34min","Hired to protect a pampered mining heiress Zoe (Sophie Nélisse), bodyguard Sam (Noomi Rapace) finds herself tangled in a deadly conspiracy. When attackers target the heiress she's protecting, battle-hardened bodyguard Sam scrambles to save her client - and teach her how to fight back."
"50","BirdBox","English","6.7","21 December 2018","2h 4min","In the wake of an unknown global terror, a mother must find the strength to flee with her children down a treacherous river in search of safety. Due to unseen deadly forces, the perilous journey must be made blindly. Directed by Emmy winner Susanne Bier, Bird Box is a thriller starring Academy Award winner Sandra Bullock, John Malkovich, Sarah Paulson, and Trevante Rhodes."
"51","Yes Man ","English, Korean, Estonian","6.8","19 December 2008","1h 44min","Carl Allen is at a standstill. No future... Until the day he enrolls into a personal development program based on a very simple idea: say yes to everything! Carl discovers with amazement the magical power of ""Yes"", and sees his professional and romantic life turned upside down overnight: an unexpected promotion and a new girlfriend. But he'll soon discover that better can be good's enemy, and that all opportunities shouldn't be taken."
"52","How to Train Your Dragon: The Hidden World ","English","7.9","22 February 2019","1h 44min","As Hiccup fulfills his dream of creating a peaceful dragon utopia, Toothless' discovery of an untamed, elusive mate draws the Night Fury away. When danger mounts at home and Hiccup's reign as village chief is tested, both dragon and rider must make impossible decisions to save their kind."
"53","6 Years","English","5.6","18 August 2015","1h 19min","A romantic drama centering around unforeseen circumstances, 6 Years is a tale about Melanie (Taissa Farmiga) and Dan (Ben Rosenfield), a young couple in love whose relationship begins to fracture. Close friends since childhood, the pair's connection is tested when Dan receives an enviable job offer from a record company. Forced to choose between his love for Melanie and his dream job, Dan's decisions prove to affect the future of both young lovers irrevocably. 6 Years is written and directed by Hannah Fidell."
"54","50 First Dates","English, Hawaiian, Mandarin, None","6.8","13 February 2004","1h 39min","Henry Roth lives in a Hawaiian paradise with the company of endless women with no strings attached. This is until he meets Lucy Whitmore. Both Henry and Lucy enjoy the company of each other and feel the start of a serious relationship occurring. Approaching Lucy the next day, Henry is confused when Lucy fails to recognize him. This is the moment Henry discovers that Lucy actually suffers from short term memory loss and can't remember each individual day. Henry won't let this stop him and is prepared to make her fall in love with him all over again, each and every day."
"55","V for Vendetta","English","8.2","17 March 2006","2h 12min","Tells the story of Evey Hammond and her unlikely but instrumental part in bringing down the fascist government that has taken control of a futuristic Great Britain. Saved from a life-and-death situation by a man in a Guy Fawkes mask who calls himself V, she learns a general summary of V's past and, after a time, decides to help him bring down those who committed the atrocities that led to Britain being in the shape that it is in."
"56","Zodiac","English","7.7","2 March 2007","2h 37min","A serial killer in the San Francisco Bay Area taunts police with his letters and cryptic messages. We follow the investigators and reporters in this lightly fictionalized account of the true 1970's case as they search for the murderer, becoming obsessed with the case. Based on Robert Graysmith's book, the movie's focus is the lives and careers of the detectives and newspaper people."
"57","Drive","English, Spanish
","7.8","16 September 2011","1h 40min","A mysterious man who has multiple jobs as a garage mechanic, a Hollywood stuntman and a getaway driver seems to be trying to escape his shady past as he falls for his neighbor - whose husband is in prison and who's looking after her child alone. Meanwhile, his garage mechanic boss is trying to set up a race team using gangland money, which implicates our driver as he is to be used as the race team's main driver. Our hero gets more than he bargained for when he meets the man who is married to the woman he loves."
"58","The Nice Guys","English, German","7.4","20 May 2016","1h 56min","Set against the backdrop of 1977 Los Angeles, The Nice Guys opens when single father and licensed PI Holland March (Gosling) is hired to investigate the apparent suicide of famous porn star Misty Mountains. As the trail leads him to track down a girl named Amelia (Qualley), he encounters less licensed and less hands-off private eye Jackson Healey (Russell Crowe) and his brass knuckles, both hired by the young hippie. However, the situation takes a turn for the worse when Amelia vanishes and it becomes apparent that March wasn't the only party interested. As both men are forced to team up, they'll have to take on a world filled with eccentric goons, strippers dressed as mermaids and even a possible government conspiracy."
"59","Crazy, Stupid, Love.","English","7.4","29 July 2011","1h 58min","Cal (Steve Carell) and Emily (Julianne Moore) have the perfect life together living the American dream... until Emily asks for a divorce. Now Cal, Mr Husband, has to navigate the single scene with a little help from his professional bachelor friend Jacob Palmer (Ryan Gosling). Make that a lot of help..."
"60","Easy A","English","7.1","17 September 2010","1h 32min","After a little white lie about losing her virginity gets out, a clean cut high school girl sees her life paralleling Hester Prynne's in ""The Scarlet Letter,"" which she is currently studying in school until she decides to use the rumor mill to advance her social and financial standing."
"61","Friends with Benefits","English","6.6","22 July 2011","1h 49min","Jamie Rellis (Mila Kunis) is a New York City head-hunter trying to sign Los Angeles-based art director Dylan Harper (Justin Timberlake) for her client. When he takes the job and makes the move, they quickly become friends. Their friendship turns into a friendship with benefits, but with Jamie's emotionally damaged past and Dylan's history of being emotionally unavailable, they have to try to not fall for each other the way Hollywood romantic comedies dictate."
"62","When We First Met ","English","6.4","9 February 2018","1h 37min","Noah thinks he has the perfect first night with Avery, the girl of his dreams, but gets relegated to the friend zone. He spends the next three years wondering what went wrong - until he gets the unexpected chance to travel back in time and change that night - and his fate - over and over again."
"63","To All the Boys I've Loved Before","English","7.3","17 August 2018","1h 39min","Lara Jean Covey writes letters to all of her past loves, the letters are meant for her eyes only. Until one day when all the love letters are sent out to her previous loves. Her life is soon thrown into chaos when her foregoing loves confront her one by one."
"64","Iron Man 1","English, Persian, Urdu, Arabic, Hungarian","7.9","2 May 2008","2h 6min","Tony Stark. Genius, billionaire, playboy, philanthropist. Son of legendary inventor and weapons contractor Howard Stark. When Tony Stark is assigned to give a weapons presentation to an Iraqi unit led by Lt. Col. James Rhodes, he's given a ride on enemy lines. That ride ends badly when Stark's Humvee that he's riding in is attacked by enemy combatants. He survives - barely - with a chest full of shrapnel and a car battery attached to his heart. In order to survive he comes up with a way to miniaturize the battery and figures out that the battery can power something else. Thus Iron Man is born. He uses the primitive device to escape from the cave in Iraq. Once back home, he then begins work on perfecting the Iron Man suit. But the man who was put in charge of Stark Industries has plans of his own to take over Tony's technology for other matters."
"65","Iron Man 2","English, French, Russian","7.0","7 May 2010","2h 4min","With the world now aware of his dual life as the armored superhero Iron Man, billionaire inventor Tony Stark faces pressure from the government, the press, and the public to share his technology with the military. Unwilling to let go of his invention, Stark, along with Pepper Potts, and James ""Rhodey"" Rhodes at his side, must forge new alliances - and confront powerful enemies."
"66","Iron Man 3","English","7.2","3 May 2013","2h 10min","Marvel's ""Iron Man 3"" pits brash-but-brilliant industrialist Tony Stark/Iron Man against an enemy whose reach knows no bounds. When Stark finds his personal world destroyed at his enemy's hands, he embarks on a harrowing quest to find those responsible. This journey, at every turn, will test his mettle. With his back against the wall, Stark is left to survive by his own devices, relying on his ingenuity and instincts to protect those closest to him. As he fights his way back, Stark discovers the answer to the question that has secretly haunted him: does the man make the suit or does the suit make the man?"
"67","Spider-Man 1","English","7.3","3 May 2002","2h 1min","Based on Marvel Comics' superhero character, this is a story of Peter Parker who is a nerdy high-schooler. He was orphaned as a child, bullied by jocks, and can't confess his crush for his stunning neighborhood girl Mary Jane Watson. To say his life is ""miserable"" is an understatement. But one day while on an excursion to a laboratory a runaway radioactive spider bites him... and his life changes in a way no one could have imagined. Peter acquires a muscle-bound physique, clear vision, ability to cling to surfaces and crawl over walls, shooting webs from his wrist ... but the fun isn't going to last. An eccentric millionaire Norman Osborn administers a performance enhancing drug on himself and his maniacal alter ego Green Goblin emerges. Now Peter Parker has to become Spider-Man and take Green Goblin to the task... or else Goblin will kill him. They come face to face and the war begins in which only one of them will survive at the end."
"68","Spider-Man 2","English, Russian, Chinese","7.3","30 June 2004","2h 7min","Peter Parker is an unhappy man: after two years of fighting crime as Spider-Man, his life has begun to fall apart. The girl he loves is engaged to someone else, his grades are slipping, he cannot keep any of his jobs, and on top of it, the newspaper Daily Bugle is attacking him viciously, claiming that Spider-Man is a criminal. He reaches the breaking point and gives up the crime fighter's life, once and for all. But after a failed fusion experiment, eccentric and obsessive scientist Dr. Otto Octavius is transformed into super villain Doctor Octopus, Doc Ock for short, having four long tentacles as extra hands. Peter guesses it might just be time for Spider-Man to return, but would he act upon it?"
"69","The Death of Superman ","English","7.4","24 July 2018","1h 21min","Superman battles against an insurmountable foe named Doomsday."
"70","Life as We Know It ","English","6.6","8 October 2010","1h 54min","Holly and Eric were set up on a blind date by their friends, Peter and Allison who are married. After Peter and Allison are killed in an accident, they learn that they have been named as the guardians to Peter and Allison's daughter, Sophie. So they move into their house and try their best to honor their friends' wishes. But raising a child puts a crimp on their style and they don't exactly get along."
"71","The Avengers","English, Russian, Hindi","8.1","4 May 2012","2h 23min","Nick Fury is the director of S.H.I.E.L.D., an international peace-keeping agency. The agency is a who's who of Marvel Super Heroes, with Iron Man, The Incredible Hulk, Thor, Captain America, Hawkeye and Black Widow. When global security is threatened by Loki and his cohorts, Nick Fury and his team will need all their powers to save the world from disaster which is formed by Loki and his team"
"72","Avengers: Infinity War","English","8.5","27 April 2018","2h 29min","As the Avengers and their allies have continued to protect the world from threats too large for any one hero to handle, a new danger has emerged from the cosmic shadows: Thanos. A despot of intergalactic infamy, his goal is to collect all six Infinity Stones, artifacts of unimaginable power, and use them to inflict his twisted will on all of reality. Everything the Avengers have fought for has led up to this moment, the fate of Earth and existence has never been more uncertain."
"73","Ant-Man","English","7.3","17 July 2015","1h 57min","Armed with the astonishing ability to shrink in scale but increase in strength, con-man Scott Lang must embrace his inner-hero and help his mentor, Dr. Hank Pym, protect the secret behind his spectacular Ant-Man suit from a new generation of towering threats. Against seemingly insurmountable obstacles, Pym and Lang must plan and pull off a heist that will save the world."
"74","The Incredible Hulk","English, Portuguese, Spanish","6.8","13 June 2008","1h 52min","Depicting the events after the Gamma Bomb. 'The Incredible Hulk' tells the story of Dr Bruce Banner, who seeks a cure to his unique condition, which causes him to turn into a giant green monster under emotional stress. Whilst on the run from military which seeks his capture, Banner comes close to a cure. But all is lost when a new creature emerges; The Abomination."
"75","Thor: The Dark World","English","7.0","8 November 2013","1h 52min","Thousands of years ago, a race of beings known as Dark Elves tried to send the universe into darkness by using a weapon known as the Aether. Warriors from Asgard stop them but their leader Malekith escapes to wait for another opportunity. The warriors find the Aether and since it cannot be destroyed, they try to hide it. In the present day, Jane Foster awaits the return of Thor although it has been two years since they last saw once another. In the meantime, Thor has been trying to bring peace to the nine realms. Jane discovers an anomaly similar to the one that brought Thor to Earth. She goes to investigate, finds a wormhole, and is sucked into it. Back on Asgard, Thor wishes to return to Earth but his father, Odin refuses to let him. Thor learns from Heimdall, who can see into all of the realms, that Jane disappeared. Thor then returns to Earth just as Jane reappears. However, when some policemen try to arrest her, an unknown energy repulses them. Thor then brings Jane to Asgard to ..."
"76","Guardians of the Galaxy Vol. 2","English","7.7","5 May 2017","2h 16min","After saving Xandar from Ronan's wrath, the Guardians are now recognized as heroes. Now the team must help their leader Star Lord (Chris Pratt) uncover the truth behind his true heritage. Along the way, old foes turn to allies and betrayal is blooming. And the Guardians find that they are up against a devastating new menace who is out to rule the galaxy."
"77","Spider-Man: Homecoming","English, Spanish","7.5","7 July 2017","2h 13min","Thrilled by his experience with the Avengers, Peter returns home, where he lives with his Aunt May, under the watchful eye of his new mentor Tony Stark, Peter tries to fall back into his normal daily routine - distracted by thoughts of proving himself to be more than just your friendly neighborhood Spider-Man - but when the Vulture emerges as a new villain, everything that Peter holds most important will be threatened."
"78","Thor: Ragnarok","English","7.9","3 November 2017","2h 10min","Thor is imprisoned on the other side of the universe and finds himself in a race against time to get back to Asgard to stop Ragnarok, the destruction of his home-world and the end of Asgardian civilization, at the hands of an all-powerful new threat, the ruthless Hela."
"79","Harry Potter and the Sorcerer's Stone","English","7.6","16 November 2001","2h 32min","This is the tale of Harry Potter, an ordinary 11-year-old boy serving as a sort of slave for his aunt and uncle who learns that he is actually a wizard and has been invited to attend the Hogwarts School for Witchcraft and Wizardry. Harry is snatched away from his mundane existence by Rubeus Hagrid, the grounds keeper for Hogwarts, and quickly thrown into a world completely foreign to both him and the viewer. Famous for an incident that happened at his birth, Harry makes friends easily at his new school. He soon finds, however, that the wizarding world is far more dangerous for him than he would have imagined, and he quickly learns that not all wizards are ones to be trusted."
"80","Harry Potter and the Chamber of Secrets","English","7.4","15 November 2002","2h 41min","Forced to spend his summer holidays with his muggle relations, Harry Potter gets a real shock when he gets a surprise visitor: Dobby the house-elf, who warns Harry Potter against returning to Hogwarts, for terrible things are going to happen. Harry decides to ignore Dobby's warning and continues with his pre-arranged schedule. But at Hogwarts, strange and terrible things are indeed happening. Harry is suddenly hearing mysterious voices from inside the walls, muggle-born students are being attacked, and a message scrawled on the wall in blood puts everyone on his or her guard, ""The Chamber Of Secrets Has Been Opened. Enemies Of The Heir, Beware"" ."
"81","Fantastic Beasts and Where to Find Them"," English","7.3"," 18 November 2016","2h 13min","In mid-20s New York, Newt Scamander, the British young activist wizard, arrives in town, holding a mysterious leather suitcase which shelters a wide array of diverse and magical creatures that exist among us. Amid an already fragile equilibrium of secrecy, and the increasing disasters ascribed to the dark wizard, Gellert Grindelwald, Newt's precious suitcase will be lost--and to make matters worse--several creatures will manage to escape. Before long, this situation will catch Senior Auror Percival Graves' attention who will target Newt, in the background of an invisible, devastating, and utterly unpredictable menace that still wreaks havoc on 5th Avenue. In the end, is there a hidden agenda behind Graves' intentions; moreover, what will happen to the remaining fantastic beasts still loose in the streets?"
"82","Fantastic Beasts: The Crimes of Grindelwald","English ","6.8","16 November 2018","2h 14min","In mid-20s New York, Newt Scamander, the British young activist wizard, arrives in town, holding a mysterious leather suitcase which shelters a wide array of diverse and magical creatures that exist among us. Amid an already fragile equilibrium of secrecy, and the increasing disasters ascribed to the dark wizard, Gellert Grindelwald, Newt's precious suitcase will be lost--and to make matters worse--several creatures will manage to escape. Before long, this situation will catch Senior Auror Percival Graves' attention who will target Newt, in the background of an invisible, devastating, and utterly unpredictable menace that still wreaks havoc on 5th Avenue. In the end, is there a hidden agenda behind Graves' intentions; moreover, what will happen to the remaining fantastic beasts still loose in the streets?"
"83","Hotel Transylvania","English","7.1"," 28 September 2012","1h 31min ","In 1895, Dracula builds a resort in Transylvania, hidden from the humans, to raise his beloved daughter Mavis in a safe environment. In the present, the place is the Hotel Transylvania, where monsters bring their families to vacation far from the frightening humans. Dracula invites his friends - Frankenstein and his wife Eunice; Wayne and Wanda, the werewolves; Griffin, the invisible man; Murray, the mummy; Bigfoot, among others - to celebrate the 118th birthday of Mavis. When the party is ready to start, the 21-year-old Jonathan is walking through the forest and stumbles upon the hotel. Dracula sees Jonathan and disguises him as a monster to hide Jonathan from the guests. But Mavis also sees Jonathan and Dracula forces him to pose as a monster. Soon Mavis believes that Jonathan is the ""zing"" of her life despite the advice of her father about humans."
