"84","Hotel Transylvania 2 ","English","6.7","25 September 2015 ","1h 29min ","The Drac pack is back for an all-new monster comedy adventure in Sony Pictures Animation's Hotel Transylvania 2! Everything seems to be changing for the better at Hotel Transylvania... Dracula's rigid monster-only hotel policy has finally relaxed, opening up its doors to human guests. But behind closed coffins, Drac is worried that his adorable half-human, half-vampire grandson, Dennis, isn't showing signs of being a vampire. So while Mavis is busy visiting her human in-laws with Johnny - and in for a major cultural shock of her own - ""Vampa"" Drac enlists his friends Frank, Murray, Wayne and Griffin to put Dennis through a ""monster-in-training"" boot camp. But little do they know that Drac's grumpy and very old, old, old school dad Vlad is about to pay a family visit to the hotel. And when Vlad finds out that his great-grandson is not a pure blood - and humans are now welcome at Hotel Transylvania - things are going to get batty"
"85","Hotel Transylvania 3: Summer Vacation ","English ","6.3","13 July 2018","1h 37min ","Mavis surprises Dracula with a family voyage on a luxury Monster Cruise Ship so he can take a vacation from providing everyone else's vacation at the hotel. The rest of Drac's Pack cannot resist going along. But once they leave port, romance arises when Dracula meets the mysterious ship Captain, Ericka. Now it's Mavis' turn to play the overprotective parent, keeping her dad and Ericka apart. Little do they know that his ""too good to be true"" love interest is actually a descendant of Abraham Van Helsing, ancient nemesis to Dracula and all other monsters."
"86","Smallfoot","English","6.7","28 September 2018","1h 36min ","A yeti named Migo is convinced that a human known only as ""Small Foot"" is real and has to prove to his tribe that it does exist with the help of Meechee and the S.E.S - Smallfoot Evidentiary Society."
"87","The House with a Clock in Its Walls ","English","6.1","21 September 2018","1h 45min","Lewis Barnavelt, after losing his parents, is sent to Michigan to live with his uncle Jonathan. He discovers his uncle is a warlock, and enters a world of magic and sorcery. But this power is not limited to good people: Lewis learns of Isaac Izard, an evil wizard who constructed a magical clock with black magic, as long as it exists it will keep ticking, counting down to doomsday. He died before he could finish the clock, but he hid the clock in his house, where Uncle Jonathan now lives. Now Lewis and Jonathan must find the clock before it finishes its countdown and ends the world."
"88","Goosebumps 2: Haunted Halloween"," English","5.7","12 October 2018 ","1h 30min","Teenager Sarah Quinn (Madison Iseman) lives with her mother Kathy (Wendi McLendon-Covey) and younger brother Sonny (Jeremy Ray Taylor) in Wardenclyffe, New York. Sarah is attempting to get into Columbia University by writing an essay about fear. Kathy agrees to watch Sonny's friend Sam Carter (Caleel Harris) while his father goes out of town. Sonny and Sam are attempting to start a garbage cleanup business, and are called after school to clean up an abandoned house. Inside, they find a locked manuscript and open it, causing Slappy the Dummy to appear. They unknowingly bring him to life by speaking magic words found in his pocket. The book is later stolen by a bully named Tommy Madigan (Payton Wich). At home, Sonny is working on his science project, a miniature version of Nikola Tesla's Wardenclyffe Tower. Slappy then reveals he's alive to Sonny and Sam, and gets their trust by using his magic to do the boy's chores and homework. Meanwhile, Sarah goes to a party to meet her boyfriend ..."
"89","Goosebumps ","English","6.3","16 October 2015","1h 47min ","After moving to a new small town, teenage Zach Cooper (Dylan Minnette) meets the beautiful girl next door, Hannah (Odeya Rush). But every silver lining has a cloud, and Zach's comes when he learns that Hannah has a mysterious dad who is revealed to be R. L. Stine (Jack Black), the author of the bestselling Goosebumps series. It turns out that there is a reason why Stine is so strange - he is a prisoner of his own imagination - the monsters that his books made famous are real, and Stine protects his readers by keeping them locked up in their books. Zach unintentionally unleashes the monsters from their manuscripts and they begin to terrorize the town. It's up to Stine, Zach, Hannah, and Zach's friend Champ (Ryan Lee) to put all the monsters back in their books."
"90","A-X-L","English","5.2","24 August 2018 ","1h 38min ","A.X.L. is a top-secret, robotic dog created by the military to help protect tomorrow's soldiers. Code named by the scientists who created him, A.X.L. stands for Attack, Exploration, Logistics, and embodies the most advanced, next-generation artificial intelligence. After an experiment gone wrong, A.X.L. is discovered hiding alone in the desert by a kind-hearted outsider named Miles (Alex Neustaedter), who finds a way to connect with him after activating his owner-pairing technology. Together, the two develop a special friendship based on trust, loyalty and compassion. Helping Miles gain the confidence he's been lacking, A.X.L. will go to any length to protect his new companion, including facing off against the scientists who created him and who will do anything to get him back. Knowing what is at stake if A.X.L. is captured, Miles teams up with a smart, resourceful ally named Sara (Becky G) to protect his new best friend on a timeless, epic adventure for the whole family."
"91","Harry Potter and the Prisoner of Azkaban","English","7.9","4 June 200","2h 22min","Harry Potter is having a tough time with his relatives (yet again). He runs away after using magic to inflate Uncle Vernon's sister Marge who was being offensive towards Harry's parents. Initially scared for using magic outside the school, he is pleasantly surprised that he won't be penalized after all. However, he soon learns that a dangerous criminal and Voldemort's trusted aide Sirius Black has escaped from the Azkaban prison and wants to kill Harry to avenge the Dark Lord. To worsen the conditions for Harry, vile creatures called Dementors are appointed to guard the school gates and inexplicably happen to have the most horrible effect on him. Little does Harry know that by the end of this year, many holes in his past (whatever he knows of it) will be filled up and he will have a clearer vision of what the future has in store..."
"92","Harry Potter and the Goblet of Fire","English, French","7.7","18 November 2005","2h 37min","Harry's fourth year at Hogwarts is about to start and he is enjoying the summer vacation with his friends. They get the tickets to The Quidditch World Cup Final but after the match is over, people dressed like Lord Voldemort's 'Death Eaters' set a fire to all the visitors' tents, coupled with the appearance of Voldemort's symbol, the 'Dark Mark' in the sky, which causes a frenzy across the magical community. That same year, Hogwarts is hosting 'The Triwizard Tournament', a magical tournament between three well-known schools of magic : Hogwarts, Beauxbatons and Durmstrang. The contestants have to be above the age of 17, and are chosen by a magical object called Goblet of Fire. On the night of selection, however, the Goblet spews out four names instead of the usual three, with Harry unwittingly being selected as the Fourth Champion. Since the magic cannot be reversed, Harry is forced to go with it and brave three exceedingly difficult tasks."
"93","Harry Potter and the Order of the Phoenix","English","7.5","11 July 2007","2h 18min","After a lonely summer on Privet Drive, Harry returns to a Hogwarts full of ill-fortune. Few of students and parents believe him or Dumbledore that Voldemort is really back. The ministry had decided to step in by appointing a new Defence Against the Dark Arts teacher that proves to be the nastiest person Harry has ever encountered. Harry also can't help stealing glances with the beautiful Cho Chang. To top it off are dreams that Harry can't explain, and a mystery behind something Voldemort is searching for. With these many things Harry begins one of his toughest years at Hogwarts School of Witchcraft and Wizardry."
"94","Harry Potter and the Deathly Hallows: Part 1","English","7.7","19 November 2010","2h 26min","Voldemort's power is growing stronger. He now has control over the Ministry of Magic and Hogwarts. Harry, Ron, and Hermione decide to finish Dumbledore's work and find the rest of the Horcruxes to defeat the Dark Lord. But little hope remains for the Trio, and the rest of the Wizarding World, so everything they do must go as planned."
"95","Harry Potter and the Deathly Hallows: Part 2","English","8.1","15 July 2011","2h 10min","Harry, Ron, and Hermione continue their quest of finding and destroying the Dark Lord's three remaining Horcruxes, the magical items responsible for his immortality. But as the mystical Deathly Hallows are uncovered, and Voldemort finds out about their mission, the biggest battle begins and life as they know it will never be the same again."
"96","The Fast and the Furious","English, Spanish","6.8","22 June 2001","1h 46min","Los Angeles street racer Dominic Toretto falls under the suspicion of the LAPD as a string of high-speed electronics truck robberies rocks the area. Brian O'Connor, an officer of the LAPD, joins the ranks of Toretto's highly skilled racing crew undercover to convict Toretto. However, O'Connor finds himself both enamored with this new world and in love with Toretto's sister, Mia. As a rival racing crew gains strength, O'Connor must decide where his loyalty really lies."
"97","2 Fast 2 Furious","English, Spanish","5.9","6 June 2003","6 June 2003","EX LAPD cop Brian O'Conner (Paul Walker) teams up with his ex-con friend Roman Pearce (Tyrese Gibson) and works with undercover U.S. Customs Service agent Monica Fuentes (Eva Mendes) to bring Miami-based drug lord Carter Verone (Cole Hauser) down."
"98","The Fast and the Furious: Tokyo Drift","English, Japanese","6.0","16 June 2006","1h 44min","An American teenager named Sean Boswell is a loner in school, however he challenges his rival for an illegal street racing, and he totals his car in the end of the race. To avoid time in prison he is sent to Tokyo to live with his father who is in the military. As soon as he arrives he discovers a new, fun but dangerous way of street racing in the underworld of the streets of Tokyo, Japan."
"99","Fast & Furious","English, Spanish","6.6","3 April 2009","1h 47min","Heading back to the streets where it all began, two men rejoin two women to blast muscle, tuner and exotic cars across Los Angeles and floor through the Mexican desert. When a crime brings them back to L.A., fugitive ex-con Dom Toretto reignites his feud with agent Brian O'Connor. But as they are forced to confront a shared enemy, Dom and Brian must give in to an uncertain new trust if they hope to outmaneuver him. And from convoy heists to precision tunnel crawls across international lines, two men will find the best way to get revenge: push the limits of what's possible behind the wheel. "
"100","Fast & Furious 6","English, Spanish, Russian, Japanese, Cantonese, Dutch","7.1","24 May 2013","2h 10min","Since Dom (Diesel) and Brian's (Walker) Rio heist toppled a kingpin's empire and left their crew with $100 million, our heroes have scattered across the globe. But their inability to return home and living forever on the lam have left their lives incomplete. Meanwhile, Hobbs (Johnson) has been tracking an organization of lethally skilled mercenary drivers across 12 countries, whose mastermind (Evans) is aided by a ruthless second-in-command revealed to be the love Dom thought was dead, Letty (Rodriguez). The only way to stop the criminal outfit is to outmatch them at street level, so Hobbs asks Dom to assemble his elite team in London. Payment? Full pardons for all of them so they can return home and make their families whole again."
